id,post_id,parent_id,body,score,created_utc,subreddit,author
c05aqes,6zkqo,c05anh6,"&gt;At 9:16 there is a claim that the guy in green is yelling about Jones being a corporate stooge. Sorry, but I bet that lots of people there are yelling, I have no idea what that guy is saying. Again, Jones seems to draw conclusions from very little evidence.

Not as much evidence as Alex claims perhaps. It isn't certain the guy in green was a provocateur, but there is more evidence of that that you point to as well. At 7:16 the guy in green is seen yelling, as Alex talks about interment camps : ""Interment camps for those who are not corporate stooges"".

Combined with ""muffle mufflowns is a corporate strooge"" later it's more compelling that you lead to believe by not mentioning that. I don't agree with Jones on 9/11, but it's entirely within the realm of possibility/probability that provocateurs would be in place at this protest.

Tangentially, I notice in the same close ups that the ""provocateurs"" are wearing Obama gear.",1,1220550367,conspiracy,[deleted]
c05ar7s,6zlb3,6zlb3,Fantastic!,1,1220552864,conspiracy,ruesdedr
c05aswh,6zlb3,c05ao41,"""Loose Change"" is what's called ""partial hangout"". They give you a good dose of truth to gain your confidence, then lead you away from the actual perps.  A plane DID hit the Pentagon.  And it was the Israelis who perpetrated 9/11.",4,1220558356,conspiracy,Johnny_Cash
c05aswi,6zlb3,c05ao41,"[in plane sight](http://video.google.com/videoplay?docid=-5386487651203625811)

[Stephen Jones lecture](http://video.google.com/videoplay?docid=964034652002408586)",2,1220558358,conspiracy,polymath22
c05at5n,6zlb3,c05ampl,"&gt;even though they were designed to withstand an impact from a commercial airliner.

No they weren't.

&gt;So you prefer to believe that 19 terrorists armed with nothing but box cutters managed to hijack 4 airplanes, got past the Norad air defence network and planted them into 2 buildings that...

No, I don't believe it. I know it.",-1,1220559274,conspiracy,[deleted]
c05atbw,6zlb3,c05ao41,"I agree with your analysis on Loose Change. Interestingly, I have been downmodded in my comment, yet you have not...",1,1220559887,conspiracy,[deleted]
c05atcd,6zlb3,c05an8v,But it's riddled with inconsistencies and as much half truths as the official story.,4,1220559922,conspiracy,[deleted]
c05aunz,6zlb3,c05ann4,"About the moon: just show me how the landing ship worked. 

It seems very simple for the eagle to accomplish a take off from any planet, and as far as I know the plans or drawings got ""lost"".",-2,1220564607,conspiracy,HOTORTILLAS
c05auzr,6zlb3,c05aunz,"Lol. I don't know if the moon landing was real or not (I wasn't there to witness it personally), but I can say that there is a hell of a lot of difference between getting out of the moon's gravitational well and getting out of a planet's gravitational well. 

We use booster rockets for a reason.",2,1220565781,conspiracy,SuperSumoYakuza
c05av83,6zlb3,c05ano5,Such as...?,1,1220566698,conspiracy,braclayrab
c05av95,6zlb3,c05atcd,Such as...?,2,1220566790,conspiracy,braclayrab
c05avb6,6zlb3,c05auzr,"I was there, it didn't happen.",1,1220566997,conspiracy,SCVirus
c05avuj,6zlb3,c05auzr,"ya, but the issue i'm concerned with is them landing safely on the moon, instead of you know fucking it up and dying horribly.

google video's ""SECRET SPACE"" delves into this.",0,1220568947,conspiracy,[deleted]
c05az4v,6zlb3,c05ann4,"you have to admit though, when watching the moon landing it looks pretty fucking fake because of the video quality. infact it does look like a shitty 60's movie.",0,1220582705,conspiracy,Purpledrank
c05az5n,6zlb3,6zlb3,"it's not exactly a conspiracy theory if others really did conspire to run planes into the WTC towers... of course that doesn't prevent labeling:
http://en.wikipedia.org/wiki/Labeling_theory",0,1220582813,conspiracy,Purpledrank
c05azyh,6zlb3,c05aktl,lulz @ dokumetry,1,1220586289,conspiracy,[deleted]
c05b0du,6zlb3,c05atcd,"that depends on which of the 3 versions of Loose Change you have seen.  The first two suck ass!  Final Cut was just released and is actually a whole new film with new footage and narrative.  I liked it much better for it gave credible sourcing and avoided speculation
Better Films than Loose Change are:
Fabled Enemies,
Terrorstorm,
Everybody's Gotta Learn Sometime,
Press For Truth,
In Their Own Words,
Truth Rising,
9/11 Mysteries,
Improbable Collapse,
Blueprint For Truth, and many others",1,1220588245,conspiracy,laptophacker
c05b1dj,6zrmf,6zrmf,Did Jesse Ventura sign or veto that one?,1,1220593237,conspiracy,[deleted]
c05b2al,6zlb3,c05at5n,"&gt;No they weren't.

**FAIL** - Yes they were!

One of the trade center’s original structural engineers, Les Robertson: *‘there is little likelihood of a collapse no matter how the building was attacked.’*

&gt;No, I don't believe it. I know it.

Wow, it was nice to meet you Mr. Cheney, because the fact you ""know it"" must mean you are privy to information the average person hasn't got access to. You need to question things more rather than just accept the lie. The ""official"" story isn't even plausible much less believable.
",1,1220598569,conspiracy,thewaywardson
c05b2by,6zrmf,c05b1dj,"He may have signed it. He was on the ""oh God, TERRORISM!!!1"" bandwagon just as most of us were for a while after 9/11. Now he openly admits that it was an inside job. He's come a long way in the last few years.",3,1220598878,conspiracy,[deleted]
c05b3f5,6zrmf,c05b2by,"Agreed.  When I was a kid (well, in 2002, I was 17, but still), I thought of Jesse Ventura as just another idiotic celebrity politician.

Now, after getting to know him and see what he's all about...I think he's awesome as hell, and I regret having ever doubted him.",1,1220608798,conspiracy,JasonDJ
c05b3k0,6zlb3,c05b2al,"&gt;FAIL - Yes they were!

Maybe they could take an impact, but they didn't include the effects of the jet fuel into the equation. It was that that weakened the supports enough to cause the towers to collapse.

&gt;You need to question things more rather than just accept the lie.

You people are always so overwhelmingly arrogant. You truly believe that it is not possible to question the official story and yet come out largely agreeing with it. When you say ""Question things"" you don't really mean question things, you mean ""Agree with us, for we are correct"". Well, fuck that, and fuck you for suggesting as such. Because the fact of the matter is, I did question it - for a long time, I was just another troofer, then I carried on questioning it and finding other evidence, and came to my own conclusion. One that, by chance, thinks the attacks were planned and executed by pissed off Muslims. 

&gt;The ""official"" story isn't even plausible much less believable.

That's just your deluded opinion.",1,1220610423,conspiracy,[deleted]
c05b3os,6zrmf,c05b2by,"Most of ""us?""  Speak for yourself.",5,1220611774,conspiracy,ih8registrations
c05b3ur,6zlb3,c05b3k0,"&gt;Maybe they could take an impact, but they didn't include the effects of the jet fuel into the equation. It was that that weakened the supports enough to cause the towers to collapse.

FAIL (again) - The building is designed to withstand fire and there is no other case in the history of the world where a fire has brought down a tall building of that kind. Jet fuel (kerosene) does not burn at a hot enough temperature to melt steel and cause the structure to collapse, if this was the case, demolition companies would save a hell of a lot of money on explosives by bringing buildings in a controlled manner down with fire. 

&gt;I did question it - for a long time, I was just another troofer, then I carried on questioning it and finding other evidence, and came to my own conclusion. One that, by chance, thinks the attacks were planned and executed by pissed off Muslims.

Troofer? lol. Listen, you may find me to be arrogant, but you sir are naieve to the facts. There is more evidence to suggest that things aren't as published in the official story than evidence exists to prove the official story. I am not a truther at all, I am just a person who has spent a lot of time looking into the events of 9/11 and a lot of it is inconsitant with the story that the government released. I can't make you change your mind, and I respect your opinion. However, you must come to terms with the fact that the official story DOES contain a lot of inconsistencies and lies which have been exposed.

&gt;the attacks were planned and executed by pissed off Muslims.

How do you explain the fact that a number of the accused hijackers are still alive? how did passports from the hijackers survive the impact and not incinerate? Comon man, if you asked these questions then you would be upmodding me, your just upset because you want to believe the lie because its more comforting the think that it was foreign insurgents rather than your own damn government. Wake up!",1,1220613308,conspiracy,thewaywardson
c05b7mb,6zkqo,c05aqes,"I wonder if ""provocateur"" is the right word. Perhaps they are just people who, on their own, think that Jones is a jerk and are, well, jerking his chain.
",0,1220630308,conspiracy,matts2
c05b7rq,6zrmf,6zrmf,"As Americans, we can expect so see this type of thing happening again and again. Speaking out against the government will bring terrorist charges...oh wait, never mind. That's already happening. 

Fuck 'em. That's all I have to say about that. ",1,1220630855,conspiracy,Noche
c05b881,6zrmf,6zrmf,Please delete and repost linking to the actual Onion article. Thx.,1,1220632196,conspiracy,theeeggman
c05b8b0,6zkqo,c05b7mb,"It may not be the right word. They absolutely could be independent, and frankly ... Jones' biases lend him to the belief they are CIA or whatever by default. Far from certain.

They certainly were doing an excellent job of playing the part of real provocateur though I suppose, with the Obama gear and playing the crazy Jones fan only to start in with the chants that cause a riot or get someone arrested/sued. It doesn't make too much of a difference in the real world. Except for the insidious aspect of it all were *proven* they were .gov.",2,1220632453,conspiracy,[deleted]
c05ba3j,6zvdr,6zvdr,"Oh come on. I'm as suspicious as the next guy with regards to 9/11, but have some fucking respect.",0,1220638238,conspiracy,[deleted]
c05ba9u,6zvdr,c05ba3j,That's bizarre. Most people with a drinking problem are in denial.,4,1220638752,conspiracy,cyber_rigger
c05babg,6zvdr,6zvdr,"Suspicion Level: Medium

While this guy witnessed the basement explosions first hand and is a reliable witness to many events that have been cause for contention, the circumstances of his suicide do not seem overly suspicious.

His drinking, anti-social behavior, and upcoming eviction do give a solid base for this to be real and not staged.  Additionally, this person does not seem to be a threat at all, and doesn't seem to be actively campaigning for the 911 truth movement or anything that would trigger such a response.  

Regardless may he rest in peace, hopefully knowing that he does have people that care about him.",2,1220638886,conspiracy,[deleted]
c05baej,6zvdr,c05babg,"So I suspect my anti-social behavior, past bouts of depression and all that mean if I'm found dead tomorrow it was 'suicide'?

**Fail**.",2,1220639161,conspiracy,ruesdedr
c05basc,6zvdr,6zvdr,"It's stuff like this that ruins everybody's credibility. Was it a conspiracy that somebody got evicted? Was it a conspiracy that somebody started drinking?

Being a witness to all that, does that mean that he'll be infinitely cheery the rest of his life? People commit suicide. People *die.* 

It doesn't mean the government did it to them. It reminds me of when George Carlin died, some people implied that it was because he had criticized the government. As though health problems no longer apply to you, if there's some conceivable notion that somebody might not be happy with you.

He was a janitor. With a drinking problem. Who witnessed 9/11. Who was losing his apartmnet, who found joy in nothing but his cat. Omg, government conspiracy!!1.",-1,1220640378,conspiracy,MassesOfTheOpiate
c05batv,6zvdr,c05baej,Logical argument? **Fail.**,0,1220640520,conspiracy,MassesOfTheOpiate
c05baur,6zvdr,c05batv,**Fail.**,2,1220640579,conspiracy,ruesdedr
c05bauz,6zvdr,c05baej,"No, correlation is not causation.  That is the point.

Just because the man died, why does it have to be the Illuminati or CIA that killed him?  

If you have past bouts of depression and are anti-social and are found dead with a suicide note written and there is nothing suspicious about the events, why would people think anything else?

If a policeman walks up to a sports car wrapped around a tree and teenager behind the wheel, what do you think that cop is thinking?

Is he thinking: 

""Damn reckless teenagers""

or

""Looks like the Illuminati got another one""

My point is that there does not seem to be anything suspicious at this time about his suicide, so why should we muddle the memory of this person by making wild claims?  

I may agree with the 911 truth movement, but I also have respect for the deceased.
",3,1220640599,conspiracy,[deleted]
c05bbck,6yhwv,c058r73,"The holocaust is a state-sanctioned religious/mythical 'conspiracy theory'.  

It was alleged, among other things at the Nuremburg trials, that the Nazis had: made Jewish shrunken heads, made soap from Jewish fat, made lampshades from Jewish skin, and that there were extermination camnps in Germany proper. All now proven to be false. People, some probably innocent, were sent to their deaths based on false evidence and false testimony. 

The gas chamber shown for decades at Aushwitz was a Soviet fabrication, and for stating that truth in Austria, David Irving went to jail for over a year.

So, it appears you are in favor people being sent to death based on false evidence in Soveit-style show trials. And you are in favor of people being jailed for making true statements.

That sounds like the sort of thing a fucking Commie-loving totalitarian politically correct piece of shit would say. Burn the heretic! 

I hope you get tossed in prison for questioning the Holodomor  or burned at the stake for questioning some asinine religious orthodoxy one day. Perhaps then you will see the error of your ways.

Telling the truth in the empire of lies is a revolutionary act.",1,1220642207,conspiracy,smsc
c05bbiv,6yhwv,c057m2z,Agreed.,1,1220642767,conspiracy,smsc
c05bdii,6zvdr,c05ba9u,"And there are those who aren't; I would expect that, if he were to utilize the reason to end his life, then he had identified it as an issue.",0,1220649017,conspiracy,[deleted]
c05be9m,6zvdr,6zvdr,"Who the fuck starts a suicide note ""The reason I killed myself..""

http://assets.nydailynews.com/img/2008/09/04/large_note.jpg",8,1220651754,conspiracy,HOTORTILLAS
c05bec5,6zvdr,c05be9m,"A guy that doesn't write for a living? If the guy doesn't care enough to live anymore, why would he care so much about how great his suicide note was written? How would you start your suicide note?
 ",-3,1220652044,conspiracy,monstercack
c05bgwz,6zvdr,c05bec5,"I am not sure, it is not as clear as a 100 floor building turning to dust in 15 seconds and call it an explosion but in fact reads like the note of an excited person not a depressed one.

Not to mention sign a personal document with your full name, it would seem as they are not even trying to cover it, this is a clear message: SHUT UP ",3,1220665368,conspiracy,HOTORTILLAS
c05bh73,6zkqo,c05b8b0,"&gt;Jones' biases lend him to the belief they are CIA or whatever by default.

Which is part of my point. This video gives us an insight into Jones's work. He cuts the video to reinforce his claims, he jumps to conclusions, and he jumps to grandiose conclusions.

&gt;It doesn't make too much of a difference in the real world.

There is an enormous difference between some organized government campaign to discredit someone and two goofy protesters jerking the chain of a wacko jerk.",-2,1220666921,conspiracy,matts2
c05bha2,6zvdr,c05baej,"Bouts of depression and drinking are actually very good indicators of potential suicide. Instead of waving it off you might want to consider seeking help.

",0,1220667393,conspiracy,matts2
c05bk7r,6zyjb,6zyjb,"Because   McCain   uses his POW capture and internment as a cornerstone of his campaign, everyone should look at this.",1,1220687921,conspiracy,DudeAsInCool
c05bkzf,6yhwv,c05bbck,"&gt;The holocaust is a state-sanctioned religious/mythical 'conspiracy theory'.

No, it's a documented, factual historical fact. Millions of Jews, Gypsies, Homosexuals, Mentally Ill Individuals and Political prisoners were executed methodically and brutally. 

&gt;Telling the truth in the empire of lies is a revolutionary act.

But denying that the most horrendous act of genocide in modern history never happened is so outright shocking and sickening that jailtime is more than warranted. Those who do not learn from mistakes are doomed to repeat them, and we cannot afford to repeat the holocaust, no matter who would be on the receiving end that time.

&gt;The gas chamber shown for decades at Aushwitz was a Soviet fabrication

That isn't the same as the actual gas chamber being a fabrication. The fact of the matter is, millions of people were killed at that place. ""How"" doesn't really matter, at the end of the day.

&gt;That sounds like the sort of thing a fucking Commie-loving totalitarian politically correct piece of shit would say. Burn the heretic!

You're either trolling or crazy, and I'm not convinced it isn't both.

",-1,1220696938,conspiracy,[deleted]
c05bm44,6zkqo,c05bh73,"I didn't downvote you FYI. Edit: (Upvoted, but it's still zero.) I hate when people do that shit, and sometimes explain myself needlessly ... nevermind. :)

Sounds like we are mostly on the same page here. I agree with almost everything you said, but I wouldn't go so far as calling him a wacko jerk. Even if he is wacko, he feels he is furthering what is the greatest cause of anyone in the country today. There is a complex for that too I assume, but it isn't jerk, IMHO.

About the semantics of the difference. I was trying to say the same thing I suppose when I said, ""Except for the insidious aspect of it all were proven they were .gov."".

What I was trying to say is whether they were or were not ""real"", I fell they did more than jerk someone's chain. They went in there and semmingly played up the crazy follower stereotype, and then did no less than try to start a riot where someone was killed, or at least end up with some character assassination and maybe some lawsuits.

Whether these people were or were not .gov is relevant for the reasons we both pointed out, but IMO, not so much in that the result was the same. Whether .gov themselves, or people so ""in love with"" the powers that be so to speak that they took it upon themselves isn't really that important IMO. Aside from the implications that if they were ""real"" some of what Jones says would have merit as opposed to it's seeming baselessness.",1,1220710709,conspiracy,[deleted]
c05bniu,6zkqo,c05bm44,"&gt;Even if he is wacko, he feels he is furthering what is the greatest cause of anyone in the country today.

Bush feels the same way. In neither case does the feeling you are on the side of the angels justify the action.

&gt;here is a complex for that too I assume, but it isn't jerk, IMHO.

I was being nice.

",0,1220719053,conspiracy,matts2
c05bocd,7010y,7010y,"This disturbs me:


""I think the government needs to let us know when we need to know, but on something like this, it's not appropriate,"" said Stephenville resident Cliff McMinn.",3,1220723474,conspiracy,[deleted]
c05boyg,6zynf,6zynf,"That's an interesting video. I haven't ever given it much thought, with so many other pressing issues at the front of my plate, but the video is interesting. The start stop action of the ""sprayers"", and the multiple planes working in a pattern is pretty hard to push aside on principle alone. Anyone who wanted to refute some of that footage has their work cut out for them.

Like I said, I'm not too interested in this frankly, but would be interested to see expert rebuttal to this.",1,1220726879,conspiracy,[deleted]
c05bpki,701hb,701hb,"Part 2

http://www.youtube.com/watch?v=iP3RsacOxC8&amp;feature=related",1,1220730240,conspiracy,SaveOurSouls
c05bq1k,6zynf,c05boyg,"Google, is it on your internet too?",0,1220732803,conspiracy,ruesdedr
c05bq6m,701mk,701mk,research vaccines for yourselves. this is not an isolated case.http://www.whale.to/b/hoax1.html,2,1220733523,conspiracy,pist
c05bq9r,6zynf,c05bq1k,"Yeah. Not sure what you mean though. I am asking for a rebuttal by someone not commenting on the video at youtube itself ... to this specific video, and preferably in aeronautics as a career. Did Google turn one up for you, because I tried and found nothing.",2,1220733998,conspiracy,[deleted]
c05bqjq,6zynf,c05bq9r,This topic has been discussed at length on the net. There is no shortage of material if you seek it.  Google turns up plenty.  Think for yourself.,0,1220735336,conspiracy,ruesdedr
c05bqp7,6zhwt,6zhwt,"I agree, war is the setup as well.",1,1220736066,conspiracy,someitguy
c05bqy3,6zynf,c05bqjq,"Man. I have to say, I sure hope this isn't something that is an important issue to you. Because if it is, you had a chance to show someone something that may have helped them understand something that they said they never gave much thought to. 

If this is something you think is just talk by nuts, then I can see why you act like you do. I would have told you yesterday people that think this theory has merit are nuts. Now though, well, I guess I still think that. 

Besides, I do a fair job of thinking for myself. After all, I am independently wealthy and have worked for presidential campaigns (seriously). You however, may not think at all, seeing as how I said:

&gt; ""a rebuttal... not ... youtube itself ... to this specific video ... preferably in aeronautics as a career.

Let me know how your search goes. Since I was an initial contributor to the the Googledork DB with guys like Johnny, Savant (Josh), murfie and others. People I know and are friends with who have been raping that engine since 2003 ... and my search for what I was looking for turned up nothing.",1,1220737415,conspiracy,[deleted]
c05br1d,7010y,c05bocd,"Well, we're talking about Texas here.  Disturbing, yes, but not the least bit surprising.",1,1220737894,conspiracy,Knapsack
c05brit,701mk,701mk,"Ignorant people like you do much more harm than all vaccines combined. Recent research demonstrated vaccines are not related to autism. The doctor who spread this idiotic rumour was struck off the medical register, as far as I remember. Vaccines need population penetration to work. Diseases they protect against can very well kill children or cause long lasting health problems. So stop spreading this FUD and go learn something useful.",-1,1220740698,conspiracy,glebd
c05brnf,7023r,7023r,"The sad thing is that Alex Jones has been so effectively discredited by the mainstream media that even mentioning his name makes people lose all faith in what you're trying to say, even if he's right.  Really sad.",5,1220741422,conspiracy,antifolkhero
c05brtz,7023r,c05brnf,"Of course, that is only people who listen to the massively discredited mainstream media.",11,1220742375,conspiracy,smsc
c05brvg,7023r,c05brtz,"That still happens to be most people.  Now if we could just kill television, then we might stand a chance.",7,1220742586,conspiracy,antifolkhero
c05bsy9,7023r,c05brnf,"Most of the issues publicly discussed by Alex Jones are worthy of discussion and investigation. However, some of the common criticisms of Jones are understandable. The concern that he personally profits from his activism is not easily dismissed. He does tend to be self aggrandizing and gratuitously confrontational. I was disturbed by his behavior recently when [he encountered Michelle Malkin](http://www.reddit.com/r/conspiracy/comments/6zkqo/totally_busted_trying_to_setup_alex_jones/).",1,1220748480,conspiracy,treebright
c05btd8,701e2,701e2,"[Iraq was invaded to protect Israel.](http://murrayr.newsvine.com/_news/2006/03/19/138862-us-invaded-iraq-to-protect-israel-new-study-shows)  -  *Philip Zelikow*    
    
I can't wait till we lay the bill at their door.",1,1220751072,conspiracy,Johnny_Cash
c05buzu,7023r,7023r,"it is the message that is important,not the messenger. like him or hating him doesn't change the message.",7,1220761808,conspiracy,pist
c05bv2s,701xy,701xy,http://www.dontchemtrailmebro.com/audio/will_thomas.mp3  good interview on chems and other population control methods,1,1220762387,conspiracy,pist
c05bxcv,7023r,7023r,Valid ideas that he is conveying but he belabors the point. There is no point in watching the entire video.,0,1220782839,conspiracy,Maxcactus
c05bz65,704ai,704ai,http://www.911missinglinks.com/ same deal with this one. the traitors are getting nervous i guess.bookmark them while you can.,4,1220802556,conspiracy,pist
c05bz80,704ai,c05bz65,"Mmmmm... yes, there were a handful of American traitors involved.  But the the gravemen of the crime rests with the *patriots* of the Global Jewish Nation.  There is a Jew  -  not on every page  -  but in every paragraph of the 9/11 saga.    The problem being that their actions were both war crimes against the People of America and crimes against humanity.    
  
I don't think there's any alternative but to take this war of extermination the Jews have been waging against White America (and the Arab world) and put an end to it once and for all.",-1,1220802917,conspiracy,Johnny_Cash
