id,post_id,parent_id,body,score,created_utc,subreddit,author
c04sbs5,6t1a9,6t1a9,"And now we know why he was killed.

There used to be honorable men in politics, instead of mad men; And when the mad men replaced the honorable men, you could be assured that others would stand up for the word of righteousness and truth.

This time has passed and now we are left with an asylum.",3,1216793402,conspiracy,[deleted]
c04sc8k,6t1a9,c04sbs5,"Kucinich, Ron Paul, have hope!",1,1216797362,conspiracy,sketec
c04sdnh,6t1a9,6t1a9,"I so wish JFK came around in the 21st century, he would have brought down the elite!",1,1216813549,conspiracy,thewaywardson
c04seh8,6t1a9,6t1a9,"here's a great documentary on the connection between his murderers and the bush family/illuminati.

[here](http://video.google.com/videoplay?docid=-4315024059102108031&amp;q=alex+jones+jfk&amp;ei=-C6HSJbcLIeIrgLaw9jECA&amp;hl=en)",2,1216818996,conspiracy,[deleted]
c04sevj,6skt1,6skt1,"Notice how close the burial vaults are to Vantage Products, the REAL manufacturer of these!

http://www.vantageproducts.com/

960 Almon Road, Covington GA, 30014

A mere 28.3 miles away from the corporate office. 



",3,1216820981,conspiracy,oldcrow
c04sf4w,6t2op,6t2op,"Brimstone?  What's next..  Operation Rapture?

I get the feeling someone has made it their own personal mission to bring about biblical prophecy.",3,1216822122,conspiracy,VirSaturnA
c04sfvj,6t2op,c04sf4w,"Other names also considered:

* Operation Burn Baby Burn
* Operation The Four Horseman of the Apocalypse
* Operation Sodom and Gamorrah
* Operation Second Death
* Operation Sorcerers Idolaters and Liars",2,1216825170,conspiracy,pets_or_meat
c04sg39,6t2op,6t2op,"When I was in the USN (1996-2001)there was an exercise exactly like this held every year. We participated once, and got to play a ""bad guy"". We flew a Saudi Flag (over a US Navy Frigate!). We got ""killed"" and got sent to just off the coast of S.C. to re-spawn; our XO had us take down the Saudi flag, so that ""rednecks won't think we're under attack."" If I remember correctly, this was in 1998 or '99.",3,1216826079,conspiracy,ColonelFuckface
c04sgli,6t1a9,c04sc8k,two people?!?!?! it's gonna take a lot more than that...,1,1216827824,conspiracy,[deleted]
c04sje3,6t2op,c04sf4w,"I have a feeling reddit has made it their own personal mission to bring about war with Iran with all these stupid 'we're going to war with Iran' postings that have been proven wrong again and again and again, but hey you got a little over 3 months left",1,1216837086,conspiracy,anarchman
c04skoc,6t1a9,c04sgli,It only takes one for great good or evil.,1,1216841472,conspiracy,Dzazter
c04skr8,6t1a9,c04skoc,"this is so far off-base... Hitler was alone? (Goebbels, Himmler, etc.) Jesus was alone (he's not even in real IMO, but to the point...)? Tesla was alone? (JP Morgan, DoD, etc.)

EDIT: the cult of personality is the problem... it takes a lot more than ONE to do ANYTHING.",3,1216841816,conspiracy,[deleted]
c04sozt,6skt1,c04riaj,"http://www.vantageproducts.com/

makes them.",1,1216860328,conspiracy,oldcrow
c04sywl,6ta4x,6ta4x,McCain probably owns the company that built it.,0,1216918986,conspiracy,antifolkhero
c04t0db,6ta4x,c04sywl,"nope, it's in his wife's name.",1,1216923575,conspiracy,oddmanout
c04t1qt,6ta5j,6ta5j,hmm...I wonder if wearing one of their taser bracelets would be a source of stress or fear?,2,1216928216,conspiracy,theantirobot
c04t2g9,6ta4x,c04t0db,McCaininite construction.  ,0,1216930551,conspiracy,antifolkhero
c04t5kg,6ta5j,6ta5j,"oh fuck.

7/24/2008 - The United States of America officially jumps the shark. 

Today: The IRS is monitoring every credit card transaction, TSA is monitoring citizens behavior, Telecom companies are colluding with the Government with no fear of reprisal and the top story at the [ACLU](http://aclu.org):

""ACLU Calls For End To Mandatory Prayer At U.S. Naval Academy"" ",4,1216944366,conspiracy,drmaxpower
c04t9vy,6ta5j,6ta5j,how could this go wrong?,2,1216970417,conspiracy,[deleted]
c04tcc8,6ta5j,c04t9vy,"Of course it can go wrong. But El Al has been using a variation on this for ages and it can also go right.
",1,1216992255,conspiracy,matts2
c04tccp,6ta5j,6ta5j,This has the potential of doing more than all of the nonsense they have done since 9/11. Behavioral profiling actually works.,1,1216992293,conspiracy,matts2
c04tfkm,6ta5j,6ta5j,"Oh great.  Just knowing they're looking for stuff like this would make me nervous &amp; sweaty, even though I wouldn't normally have anything to worry about and not doing anything wrong.
",1,1217003898,conspiracy,indycysive
c04u6vx,6toyk,6toyk,"My opinion did a 180 while watching this, and it confirmed my worst fears.

I went in thinking ""This is a bit extreme, author must be paranoid"".

Not that I think it will ever come up - I ain't talkin to the police if anything happens.",8,1217199672,conspiracy,oldcrow
c04u7vr,6toyk,6toyk,"Notice how he continually defers-to and ass-kisses the cop, but the cop doesn't do anything deferential in return.",3,1217205528,conspiracy,Deacon
c04ue3b,6t18h,6t18h,god damn liberal hippy aliens!,1,1217250384,conspiracy,thewaywardson
c04ue4j,6tq03,6tq03,This really needs to be upmodded more .. its a *signficantly* important issue to our day and age.  Lets hope we redditors can lift it into the consciousness of more and more people ..,3,1217250548,conspiracy,bebnet
c04uf7o,6toyk,c04u7vr,The cop doesn't have a microphone.,1,1217255875,conspiracy,antifolkhero
c04ufin,6tq03,c04ue4j,upmodding as fast as I can.,2,1217257064,conspiracy,[deleted]
c04ugcm,6tst3,6tst3,That would be cool if it's him.,1,1217260147,conspiracy,4shane76
c04ugia,6toyk,6toyk,"The scary thing here is, is how so little protection even the fifth amendment provides. The court system has turned into nothing more than a processing mill these days and never really proves innocence or guilt, but just luck on the court not being able to convict a defendant. If the court system wasn't such a lie and it was truly innocent until proven guilty, there wouldn't be so many games and reasons and methods to try to incriminate you. What is even more scary, they are now trying to make more laws and ways for us to end up in this processing mill so that even more of us are, sometimes without knowing, breaking a law that is then used against us and gets us in jail. 

America has lost so much of it's freedom. And it's only getting worse. ",2,1217260679,conspiracy,-J-
c04ugn6,6tq03,6tq03,"So it begs two questions to me: What are you going to do about it and how can the power of the bankers be minimized? Here is a suggestion to get involved...No grassroots movement ever just appeared but begins with the first domino. Craigslist and Farmers Markets are a great place to start. Try it once in a while when you can. Make a short list of the skills and items you have to trade and seek opportunities to use it. One persons trash is another's treasure. Google barter in your town and see who is involved. It will not replace money but it is a start. Also will prepare you is the SHTF financially and your money is no longer any good.  That seems to be on everybodys minds lately. Remember the guy who traded a paper clip for a house.
http://www.google.com/search?aq=f&amp;hl=en&amp;client=firefox-a&amp;rls=org.mozilla%3Aen-US%3Aofficial&amp;hs=lAV&amp;q=barter+exchange&amp;btnG=Search",1,1217261117,conspiracy,[deleted]
c04uh94,6toyk,c04uf7o,The second half of that video (seen separately) is the police detective's rebuttal. I should've made that clear to begin with.,1,1217263116,conspiracy,Deacon
c04ujuu,6toyk,c04uh94,"I didn't watch it, but I'm sure it wasn't nearly as interesting.",1,1217271831,conspiracy,antifolkhero
c04ulzs,6tst3,6tst3,Is it possible to c/p this?  I'm at work and it is blocked.,1,1217279366,conspiracy,[deleted]
c04uvwl,6tst3,c04ulzs,"An attorney who is writing a book about the D.B. Cooper investigation claims the legendary hijacker who vanished from the back of a passenger jet with $200,000 in ransom in 1971 survived and returned to his life as a college instructor in Ogden.

Federal investigators are aware of the claim and are treating it like more than 1,000 other leads they have checked out over the last 36 1/2 years. They're skeptical that the late William ""Wolfgang"" Gossett pulled off the heist many others have claimed to but were found to be hoaxes.

""There is not one link to the D.B. Cooper case other than the statements (Gossett) made to someone,"" said FBI Special Agent Larry Carr, who is overseeing the Cooper investigation.

The Standard-Examiner reported in a story Sunday that Gossett told his sons and a few friends that he was the illustrious Cooper - who investigators believe didn't survive the parachute jump over the Pacific Northwest in November 1971 but have never been able to prove it.

Galen Cook, a Spokane, Wash., attorney who has been investigating the Cooper case for more than two decades, said he has submitted a fingerprint of Gossett's to the FBI's Seattle field office and hopes it will confirm his theory, which he plans to publish in a book.

Gossett had military experience, including wilderness survival, and looked like the FBI composite sketch of Cooper, Cook said.

""He had the opportunity, talent and motive to carry out the crime,"" Cook told the Standard-Examiner.

Gossett died in 2003 at the age of 73. His son, Greg, still lives in Ogden, where he said his father told him on his 21st birthday that he had hijacked the plane, then revealed to his son two keys to a safety deposit box at a bank in Vancouver, British Columbia, where the money was stored.

""He said that I could never tell anybody until after he died,"" Greg Gossett said.

Kirk Gossett, another son, says his father also told the story several times.

""He had the type of temperament to do something like this,"" Kirk Gossett said.

After a career in the military, Gossett worked in the early 1970s as an ROTC instructor and military law instructor at Weber State in Ogden. He also worked as a radio talk-show host in Salt Lake City, where he moderated discussions about the paranormal.

While Carr was doubtful that the fingerprint and hair samples Cook has from Gossett would prove anything, the FBI has heard tales that were more far-fetched.

""Everything about the case is just bizarre,"" Carr said.",1,1217338563,conspiracy,SpiderJerusalem
c04uzgk,6tst3,c04uvwl,Thank you.,1,1217351365,conspiracy,[deleted]
c04uzs2,6tzlu,6tzlu,http://mpandgs.blogspot.com/2008/07/sinclair-not-in-gurnee-illinois-nov.html,1,1217352361,conspiracy,windeva
c04v04w,6tv21,6tv21,"&gt;""It's not like we didn't have our eyes open. We found six other planes while we were looking for him. We're pretty good at what we do."" 

Then shouldn't they have already found those other 6 planes?",3,1217353427,conspiracy,[deleted]
c04v0fx,6tzlu,6tzlu,And here I thought this was going to be an article about Upton.,1,1217354380,conspiracy,karmadillo
c04v7cb,6u23o,6u23o,I'm sure he gave himself two black eyes and a busted spleen right before doing that too.,1,1217383750,conspiracy,[deleted]
c04v8jg,6u2gm,6u2gm,"what a refreshing well written article. The way in which pastor expresses his views, in a rather clear and reasoned way, makes you want to consider the merits of a ""community""; athough i do instinctively have to suspect a foot in the door there  and would want a more federated nature...and also given, that i don't have an exessive amount of feeling about particular national entities  (except for Laputa).....what do you think?
 the submitter name and category seem odd though? ",1,1217390384,conspiracy,bodenplukt
c04v8lw,6u23o,6u23o,"Jim Webb: possible Obama VP pick, and formerly President Reagan's secretary of the Navy. ...*just searching*... Hmmmm, I bet Jim Webb knows some very nasty facts about John F. Lehman, Jr., Ronald Reagan's first secretary of the Navy. If you like conspiracy theories, or mere institutional analysis, check this that guy out. PNAC, 9/11 commission, investment banker, a bunch of other R-wing think tanks, was in-line to replace Rumsfeld, or become CIA Director, and now adviser to McCain in his presidential bid. http://en.wikipedia.org/wiki/John_Lehman
*Just sayin'....*

                                    
Addendum: Not that I'm likin' the source exactly but this is verrry interesting! (about John Lehman) http://www.arabnews.com/?page=7&amp;section=0&amp;article=47381&amp;d=26&amp;m=6&amp;y=2004
                                                  

 
Addendum #2: Here's a good profile story on Fred Hutchins from early 2007. http://www.roanoke.com/politics/wb/wb/xp-99744",3,1217390807,conspiracy,redbits
c04v8wn,6u2gm,c04v8jg,"The North American Union has been a major focus of various conspiracy theories over the years. 

Many groups FEAR the loss of national sovereignty to a larger regional or world government.

And given that while reasonable people can come up with interesting ideas, political leaders are not always honest, capable, rational, well informed, or even well motivated.

It might be surprising that I could have an opinion on the topic.

Of course, even the spanish conquistadors wrestled with the concept of who was human, and thus worthy of respect, and who was not.

http://www.pbs.org/conquistadors/devaca/devaca_b00.html",2,1217392683,conspiracy,scientologist2
c04vapl,6u23o,6u23o,I don't know anyone could find a conspiracy from the death of 26 year old Senate aide. It sounds like a possible suicide.,0,1217405645,conspiracy,DudeAsInCool
c04vaqx,6u2dg,6u2dg,"Ahhh, what can you say; just a few folks getting together for some Cock and Cake although they were all out of Cake...",6,1217406072,conspiracy,[deleted]
c04vaw7,6u2rq,6u2rq,"""This country deserves a better class of criminals""",5,1217407678,conspiracy,mposha
c04vb11,6u2rq,6u2rq,"[This is a better video of the same, without the music obscuring the call.](http://youtube.com/watch?v=vo7r4K9mLy0)",8,1217408769,conspiracy,[deleted]
c04vb3k,6u2rq,6u2rq,"This country is suffering from a severe case of paranoid schizophrenia.  Holy faucking shit, what a waste of time and a load of propaganda.",-9,1217409325,conspiracy,El_Guapo
c04vbdp,6u23o,c04v7cb,"Oh, that reminds me of that fellow several months back that bound up his own arms and legs with rope, duct taped his mouth shut, beat the hell out of his own face, and then threw himself into a river.",1,1217411900,conspiracy,VirSaturnA
c04vc8k,6u2rq,6u2rq,"People are stupid enough to be able to even deny God if he stands right in front of his/her face telling them He exists. (And dumb enough to not get the spirit of that statement too.) 

So how could this be any different? No amount of evidence or proof will convince the masses that a conspiracy could possibly be true. I am willing to bet this person is either dead, or was offered a sum of money (at first, and then killed later or simply made to disappear in another country) to make the call and change their lives completely. It isn't any wonder that no one has been allowed to get personal information of each passenger because I am willing to bet there would be a commonality between them that the perpetrators of this used to find these people.  

Because I am not blind to everything I decide without real information something to be too unbelievable to be allowed to be possible, I have sought out everything I can and have come to the conclusion with all the time spent that 9/11, in it's entirety, was an inside job. For the purpose to set in motion events of our very quick and total economic downfall to consolidate power further to the elite few who arbitrated this plan. WW 2 never ended. It just changed it's face and theater of battle.

Stop being so ignorant and read about Prescott Bush. Read about the one common affiliation all presidents since Richard Nixon held and hold (bilderbergs, etc.). Do it, and stop perpetuating your armchair logic based on what you see on the news and what you have closed your mind to because you feel like it. This dissonance is exactly what is being exploited to allow these people to do what they are doing now. ",13,1217420168,conspiracy,-J-
c04vcoz,6u2rq,c04vc8k,OH MY GOD YOU'VE OPENED MY EYES!!!,-2,1217422958,conspiracy,[deleted]
c04vcqk,6u2rq,6u2rq,"people, this is what happens when you let your kids have unlimited access to the internet.",-2,1217423205,conspiracy,fromagewiz
c04vdh8,6u2rq,c04vc8k,"Some points of critical reasoning, which isn't to say that I endorse everything I'm about to say, but I'm willing to use it in an argument to get a better idea of how you think:  

1)  Why is Bilderberg inherently bad?  We, and our allies, have very complicated economic structures and political wills.  Should there not be think tanks that pool their resources and try to imagine how all of our resources work best together?  If a one-world government could offer peace and prosperity, is that end in itself something worth working against?

2)  What does this phone call really say?  It says nothing.  It's a phone call.  The fact that the husband finds it suspicious is still meaningless, as I feel that he's among us as many others are as one of the people whose minds were fucked-up on 9/11.  And, he lost a wife.  It's called grief.  It's not a conclusion by itself.


3)  Why can't we get any agreement among the conspiracy theorists?  Doesn't that mean anything?  Did the plane land in Cincinatti or Chicago?  doesn't that detail mean something?  Were there 4 planes, 5 planes, 8 planes, or no planes?  We can't even agree on that, can we?  If there are so many contradicting theories about what happened on 9/11, then it stands to reason that all but one of them are false.


Please realize that the vast majority of people, even those who criticise the videos, are more than ready to accept that there were suspicious major failures that led up to this event, failures that can only come from incompetance or complacency with the ""goals of the hijackers.""  When someone criticizes a 9/11 video, often times it has nothing to do with whether or not he or she can imagine it possible that this might've been some possible coup d'tat (of either the president or the people), but rather they are critical of how ""evidence"" is portrayed and taken grossly out of context with little to no clear reasoning skills.  I can completely accept that this phone call is a genuine example of a woman on a doomed airplane, AND I can still say that shady things led up to 9/11.  Wow, isn't that neat?


I earlier stated that this video was evidence of paranoid schizophrenia and I stand by that statement.  My beliefs are more grounded in scientific methodologies than the actual contents of that video, as they are presented.  

But no matter how I respond to a particular video -- and I think we can all admit that there's some grossly misrepresented bullshit out there on all sides -- that has little impact on my overall opinion.  Many of these videos, and those that champion them as ""truth,"" are symptomatic of ""Group Think.""  Their methodologies are entirely unsound, but because they all arrive at conclusions you're predeterminedly willing to accept, some people put them on a pedestal.

I'm not one of those people.
",4,1217426913,conspiracy,El_Guapo
c04vdpr,6u2rq,c04vb11,I prefer the one with the music.,0,1217428017,conspiracy,antifolkhero
c04vdqw,6u2rq,c04vdh8,"&gt;What does this phone call really say? It says nothing. It's a phone call. The fact that the husband finds it suspicious is still meaningless, as I feel that he's among us as many others are as one of the people whose minds were fucked-up on 9/11. And, he lost a wife. It's called grief. It's not a conclusion by itself.

Let's see.  How about the fact that it was from a cell phone when it was purportedly in the air (where cell phones don't work)?  Or the fact that she was told she ""did great"" immediately after making the call (implying she was fed the lines)?  How did she hear that the other hijacked planes had hit the world trade center?  And why were her personal belongings not vaporized with everything else?  

I'll tell you what.  Refute all of those points and maybe I'll believe you have a credible argument.  ",5,1217428158,conspiracy,antifolkhero
c04vdr3,6u2rq,c04vcqk,"What, they find your mistakes?",2,1217428189,conspiracy,antifolkhero
c04vdvp,6u2rq,6u2rq,"Sounds like ""People, pray.""",2,1217428781,conspiracy,deanoplex
c04ve6x,6u2rq,c04vdqw,"Easily and with confidence.

1.  It was from a cell phone and it couldn't have possibly worked.

There are massive points of dispute about this, and I feel that if there's credible dispute then I believe that it was possible to make the call.  Why?  Where was the plane when the call was made?  We can actually find this out with research (I'm not a researcher) but it can be argued that if the plane was at a low enough altitude it could've been in range of the cell phone network.  High-ranking people with the technological know-how are amazed that the calls lasted as long as they did.  That's a valid point.  Given the volume of the phone calls, the level of desperation involved in attempting such a call (multiple people making multiple attempts until success), and the fact that all of the phone calls agree with the official story (ie, no young kids yelling ""IT'S A TRAP!  THE GOVERNMENT IS TRYING TO KILL ME!""), and I would generally agree that the feeling of the phone-call is genuine.  Is it probable that a cell-phone call would be connected from an airplane?   Probably not.  Is it still possible?  Please.  It's technology.  I believe we've all had experiences in life where we used technology to beat the odds when we thought something was broken.


2)  Why did someone tell her ""Great job.""

She's a woman and she's making a phone call while surrounded by her female co-workers at a desperate time and she's emotionally devastated.  Her friends are supporting her, while at the same time she's bawling her eyes out.  I'm cool with that.  That explanation, to me, is a hell of a lot more reasonable than some jerk-off asserting that she had a gun pointed to her head, was not on a plane, and was carted off and shot.  Edit:  I also believe that the muffling sounds at the end of the phone-call were the fact that she couldn't bring herself to end the call, because that act was symbolic of her essentially ending her life with her loved ones.  She gets a hug by her friends, starts crying, is told ""great job"" several times, then can finally close the phone.


3)  How did she hear about the planes.

She heard about the other planes the same way we all did on 9/11.  People were talking about it.  I guarantee you that the greatest number of people talking about 9/11 at the time were people on planes.


4)  How did we get shiny documents.


Vaporized is a hell of a term.  I honestly don't know what you mean by that, simply because I've never seen anything vaporized.  Especially not a plane.  This is where things get foggy, because there are people saying the plane was vaporized.  What does that mean?  I don't know.  Other people say that an entire plane can't possibly be vaporized by jet fuel alone.  What does that mean?  I don't know.  Was the plane shot down in the air?  Did the plane impact directly into the ground?  Did the plane land elsewhere?  You see, nobody can really tell me what happened to that plane.  If it was shot-down, nobody agrees and nobody official would put their reputation on the line and say it was.  I have no idea.  But let's say the plane impacted and burst into a fireball like everyone says.  Very few fires are total.  We also don't know how it was found.  Maybe those documents were in the charred remains of a purse.  Honestly, I don't find that detail to be of critical importance by itself -- nor the terrorist passport.  They pulled hundreds of IDs out of that building.  It doesn't necessarily say anything to find an ID that we can all put a face and voice to.


4)  Here's one you didn't bring up:  Why was there no ""jet noise"" in the phone call?  

That's a good point.  That might mean something.  But not all jets are roaringly loud as they were in the 1970's.  Some planes can fly at very calm cruising speeds with little disturbance in the cabin.  I still remember the jet from the movie *The Twilight Zone*.  That was a loud jet.  It screamed.  A few of those are still in existance.  But most jets are quieter.  Where was she when she made the call?  How far away was she from the engine?  If she was at the tail of the plane, perhaps the noise would be quieter.  What type of phone did she have?  We don't know that either, do we.  Some phones pick up more ambient noise than others, some are pretty quiet and have noise-cancelling.  Was noise-cancelling software in phones in 2001?  What type of phone did she have?  We don't know.


Find that out for me and prove me wrong point by point with documentation and evidence, hard evidence with people's names, product model-numbers, company logos, years, and tracking numbers, and maybe I'll start listening.  But this was just a demented video with paranoid speculation.  It doesn't say anything.  It doesn't serve to mean shit.",1,1217430110,conspiracy,El_Guapo
c04ve7q,6u2dg,c04vaqx,I think they gather for dick as well. This shit is really creepy and weird. The bohemian grove break in was one of the first things to wake me up to what our government is actually up to.,4,1217430238,conspiracy,[deleted]
