id,post_id,parent_id,body,score,created_utc,subreddit,author
c055l7w,6xnq5,c055ixg,"Listen, if you want to provide ""links"" to substantiate that this video was ""discredited long ago"" fine, but don't engage in the same old tactics these criminals have used since the beginning: hiding behind ad hominem attacks, i.e. anyone who has suspect Mossad/Israeli involvement in 911 is anti-semitic or doesn't support the troops or ins't patriotic or is mentally ill.

There exists a substantial amount of a substantial amount of ""credited"" evidence indicates Israeli/Mossad involvement in 911, as well as involvement by the Bush family.

I now assume you are a tool. If I were you, instead hoping that the old ad hominem memes will continue to work, I would look for an ""out"". A way to save your ass, because when the dam breaks and the world's people rise up to confront this small coalition of criminal cabals that have tried to wrest control of the planet using false-flag terror, GLADIO-type operations to create chaos, pre-emptive war, murder, and shock and awe capitalism you will need a new game-plan.

Hey, how about land for peace? That'd be a good one. I hear a few people won Nobel Prizes for that idea.",1,1219594429,conspiracy,the_big_wedding
c055lan,6xnq5,c055bz4,http://www.rawstory.com/news/2006/Less_than_half_of_Americans_satisfied_0523.html,1,1219594978,conspiracy,pist
c055m7e,6xqsy,c055j1n,Couldn't they detox the aluminium &amp; restore the neuro-damage?,0,1219600140,conspiracy,Erudecorp
c055n37,6xqsy,c055m7e,I've heard good things but not getting into that position in the first place is a better option.,3,1219605421,conspiracy,SpiderJerusalem
c055nt8,6xnq5,c055lan,"&gt;those that were also most skeptical about official accounts of 9/11, including African-Americans, progressives, and those with lower incomes

",1,1219609491,conspiracy,b34nz
c055ocq,6xqsy,c055j51,"but on the same note, who's choice is it? Do you not punish parents who deny their own children protection from debilitating diseases?  Without vaccines that child is going to run the risk of catching Diphtheria, Measles, Mump, Polio, Rotavirus, Rubella, Tetnis, or tons of others I can't think of right now.  Do we really want to say it's OK to prevent proper immunization?  

I mean, you get a right to raise your child however you want, but should preferring your child catch polio because you saw Jenny McCarthy on the morning show say her child got autism from some shots? (There is *no* proof or substantial evidence that says this, meanwhile there's tons that say vaccines do prevent disease)",5,1219612545,conspiracy,oddmanout
c055oxu,6xqsy,c055j1n,"OK but if the child get's hep b and dies, they should go to jail for murder.",3,1219615934,conspiracy,oddmanout
c055spo,6xqsy,c055j51,"Made in a lab eliminated smallpox from the world. It almost eliminated polio until some people ""believed"" that the vaccine was evil. The baby is being forced to take a big known risk of dying from liver failure because someone ""feels"" the vaccine is bad.

",3,1219635991,conspiracy,matts2
c055spw,6xqsy,c055j1n,"Well, they believe and they feel, that is enough, right?",1,1219636021,conspiracy,matts2
c055vdc,6xqsy,c055spw,"Since it is their child, yeah.",1,1219658528,conspiracy,SaveOurSouls
c055xso,6xw66,6xw66,about to be?,0,1219676936,conspiracy,pist
c0560bx,6xwm7,6xwm7,911- the 800 pound gorilla in the room.,5,1219687346,conspiracy,pist
c0562it,6xy8b,6xy8b,"Quote from the site

""This Book, Smack Down 9-11, went under contract in 2006, yet never saw the light of day. During that time I experienced Mail Tampering, Criminal Forgery, Attempted Theft, Harassment, and was also the victim of Restraint of Trade on the part of the Publisher. I was also victimized further through the highly questionable rulings against me in Arbitration---which I lost. So after Fruitless attempts at finding another Publisher---and simple fact that the publication process would only be destroyed again---Smack Down 9-11 is now available as an E-Book AS IS for the BARGAIN price of $10 dollars (US)! Here is a 480-page 9-11 book that includes the MOST work ever done on the 9-11 Transcripts EVER (which included a canvassing of approx. 20,000 pgs. of 9-11 Transcipts). Smack Down 9-11 is the most Explosive Expose' on 9-11-01 available!!""",4,1219696092,conspiracy,[deleted]
c0562ln,6xy8b,6xy8b,Unreadable. Green on black. Eurgh!,2,1219696369,conspiracy,crazybones
c05634r,6xwm7,c0560bx,"Too bad everyone has 800 pound gorilla fatigue.

""Honey I heard uhh... on the news, the NIST said it was heat that expanded the metal and umm... that's why building seven uhh... honey, uhh what time is American Gladiators on? Are we missing it?""",3,1219698369,conspiracy,karmadillo
c0563ye,6xwm7,c05634r,"By the time any truth comes out officially (if it ever does) people will have no interest at all. Even if Bush came out and told everyone tomorrow, very few people would care as long as he added something like, ""sorry about that, that's why I am giving everyone in America $500.""",2,1219701747,conspiracy,crapfoodpants
c0564fv,6xwm7,6xwm7,Democrats are cowards for not impeaching the Liar in Chief.,6,1219703907,conspiracy,mushpuppy
c0564pi,6xwm7,6xwm7,As long as I gots my hot pockets n budwisers I don't give fuck bout how them towelheads did the 911.,2,1219705191,conspiracy,Neuro420
c0565h2,6ww7u,6ww7u,"Your government loves you, they just want you to take a nap.",1,1219708606,conspiracy,Neuro420
c0566ae,6xwm7,c0564pi,"If'n it don't fit on the hood of a NASCAR then I ain't gots the time to read it.

Hey Bubba, hows 'bout passin' one-a-dem Buds over here?",2,1219712874,conspiracy,DiamondBack
c05673s,6xwm7,6xwm7,"here's a classic that remind us some things never change. if anyone sees this that deems it worthy to post, please try. maybe you will have better luck than me.http://video.google.com/videosearch?q=%22secret+government# ",2,1219717232,conspiracy,pist
c0567y3,6xwm7,c0564fv,"According to one democrat the reason they won't move for impeachment is because Bush will declare war with Iran, declare a national emergency and suspend the elections.",1,1219721328,conspiracy,Phazon
c0568od,6xwm7,6xwm7,"This wouldn't have happened if Henry Kissinger would have remained in the commission,,cough",2,1219725204,conspiracy,[deleted]
c0569hm,6xwm7,c0567y3,He's gona do that anyways. He just wanted one last Christmas as president so he could hopefully finally get that Wii. ,1,1219730365,conspiracy,RayWest
c056ato,6x8zv,6x8zv,"NSA is definitely reading your emails, and pr0n.",1,1219742802,conspiracy,ruesdedr
c056azg,6wfno,6wfno,Save money and continue with life as normal. Perhaps vote if you don't already. Inform others. Don't do anything stupid.,2,1219744798,conspiracy,ruesdedr
c056dux,6xy8b,6xy8b,"THE DEATH STAR WAS AN INSIDE JOB!

WAKE UP SHEEPLE!!!!!!!!!!",-2,1219762370,conspiracy,HextorFreebish
c056dy8,6xltm,6xltm,"I think the real question we should be asking is...

How did the Reddit logo find its way onto the $1 bill ALL THE WAY BACK IN 1935!?!?

Has their little experiment with new options-backdating technologies lead to even more sinister financial applications?",1,1219762682,conspiracy,HextorFreebish
c056h66,6xqsy,c055ocq,"tons 'o evidence, sounds like you've done allot of research. If your government wasn't so devious people wouldn't be suspicious of everything. If you think they would never do you any harm just look at the tuskegee experiments. It was black people they didn't care about before, now its the poor.",1,1219774114,conspiracy,Neuro420
c056h90,6xqsy,c056h66,"well, If the choices are between believing doctors or Jenny McCarthy, I'm going to go with the doctors.",1,1219774408,conspiracy,oddmanout
c056im0,6y2nf,6y2nf,"9/11 was indeed a false flag, self-inflicted wound.  It was a lie to the American people and the world.

If you don't believe this, it's simply because you're mind doesn't want to believe it, and you're just disregarding the facts as something not possible.  All the evidence is clean-cut, and in front of you.",8,1219778898,conspiracy,marcushe
c056lww,6y2nf,c056im0,"But but but... what about the  Arabic flight manual in Atta's car! 

Come to think of it...maybe that's why he crashed. Forgot the manual. Bummer.
",2,1219791500,conspiracy,everyone_is_a_robot
c056rhl,6wfno,c05214n,Just watched a 'reptilian' video with over 1million views and 4.5 stars and I can **truly say** that was the only time I feel I've ever wasted on youtube.,0,1219821610,conspiracy,ruesdedr
c056rjg,6u2rq,6u2rq,"True story : several years after 9/11 I saw a half page ad for using cell phones on jets as a 'new' feature.  

Question : if cell phones work oh so well from planes, why make the service?

Question : the cell phone calls made 'from the jets' on 9/11 are absolutely chilling. so is the atc chat.

Mark Bingham : 6ft 4, 225lbs, rugby player, did the running of the bulls, defends against gun armed thugs.  Who exactly stopped this man? And with BOX CUTTERS? Surely you jest.

http://en.wikipedia.org/wiki/Mark_Bingham

More cell fun : 

http://www.globalresearch.ca/articles/CHO408B.html

Let's have a Google !

http://www.google.com/search?q=where+did+flight+93+land",1,1219822073,conspiracy,ruesdedr
c056rnp,6skt1,6skt1,"They are just for fun! Stop asking so many questions, citizen.",1,1219823021,conspiracy,ruesdedr
c056rrr,6ks6x,6ks6x,Your straw man? I loved it. He's definitely down for the count.,1,1219824185,conspiracy,ruesdedr
c056ta4,6xltm,c0557fe,"That's from Monty Python's Quest for the Holy Grail, when King Arthur asks the French for help in finding it and as part of their response they say ""I fart in your general direction"". ",1,1219839859,conspiracy,trech
c056xau,6xltm,c056ta4,I never got into Monty Python. I only encountered it on South Park in their spoof episode and it just seemed like alota nonsense.,0,1219855771,conspiracy,SaveOurSouls
c056yen,6yaqb,6yaqb,"Interesting video... was good except for that ""Come to Jesus"" bit at the end.",2,1219859258,conspiracy,[deleted]
c056zqu,6yb3h,6yb3h,any clergy  that have knowledge of this want to share?,1,1219863661,conspiracy,pist
c0571jc,6yaqb,c056xt5,That's really fucking creepy.,3,1219869685,conspiracy,fujimitsu
c05721m,6yaqb,6yaqb,this was debunked a long time ago by abovetopsecret.com.  Essentially those are burial vaults used for protecting coffins and are currently used widely in the undertaking industry.  You can catch the debunking on page 7 of this thread.  http://www.abovetopsecret.com/forum/thread321952/pg7 ,3,1219871311,conspiracy,bokin
c0572pw,6yaqb,6yaqb,"That's not an abandoned military base/YMCA/gated community for elderly rich people...

....IT'S A FULLY ARMED AND OPERATIONAL BATTLE STATEION!!!1",3,1219873711,conspiracy,[deleted]
c0573c2,6yaqb,6yaqb,"Why on earth does the maker think that Bushes imaginary friend will save me? That's just retarded.

See, every time Americans discover their government is lying to them, the loudest people will purpose the most idiotic ideas along with the useful information. It's odd enough that your government orders that many coffins, but leave the Nazi's out of the equation, unless you talk about Prescot Bush financing Hitler well into 1942 via his bank in Rotterdam.
Also, leave Jesus out of the story. It's hard enough to tell conspiracy facts from conspiracy theory, so don't blur the image by applying a Jesusfilter.",5,1219876184,conspiracy,behanger
c0573ng,6yaqb,c05721m,"OK, but why are they there?",1,1219877613,conspiracy,Neuro420
c0573yx,6yaqb,6yaqb,"Okay, I get the FEMA detention camp... but whats with the ""BELIEVE IN JESUS"" bullshit at the end? Isn't it the religous (doesnt matter which, be it Christian/Lucifarian/Muslim/Hebrew)?",2,1219879011,conspiracy,[deleted]
c0574f1,6yaqb,c0573ng,FEMA is for natural disasters right?  Maybe they're there in the event a lot of people die from a natural disaster?,1,1219881042,conspiracy,tekrat
c0575vg,6yd8d,6yd8d,"&gt;The Roman Empire was in decline after Julius Ceasar was assassinated.

Sorry, but the Roman Empire did not even start until Caesar was assassinated. Augustus, Caesar's nephew, was the first emperor. If you can't get obvious facts correct, why do you expect anyone to believe the made up stuff?

Edit: the coward who posted this has now lied about a comment under my name on his blog. Ignorant and cowardly, wow.


",1,1219887985,conspiracy,matts2
c0576e1,6ydam,6ydam,this belongs in the the newspeak subreddit,1,1219890576,conspiracy,ka62c
c0576n2,6ydam,c0576e1,[Added.](http://www.reddit.com/r/newspeak/comments/6ydju/montana_supreme_court_justice_warns_orwells_1984/),1,1219891824,conspiracy,[deleted]
c05774a,6yaqb,6yaqb,Tear them down!!,1,1219894203,conspiracy,DudeAsInCool
c0577h1,6yd8d,6yd8d,Nice example for [Poe's law](http://rationalwiki.com/wiki/Poe's_Law).,1,1219896080,conspiracy,oku
c0578gm,6ydam,6ydam,OCEANIA - FUCK YEAH!,2,1219901409,conspiracy,executivemonkey
c0579wn,6ydam,6ydam,Cool any hot party chicks wanna meet me in the woods later? Dirtier the better,1,1219912659,conspiracy,mch
c057aho,6ydam,6ydam,2005? really? wow. nothing like recycling.,-2,1219918761,conspiracy,[deleted]
c057bzy,6yaqb,6yaqb,"I am all for a good conspiracy theory, but if anyone thinks the US government can wage war against it's own people, they are mistaken. First, we pay their paycheck. They know if they want to continue to buy their new camps for internment and toys of oppression, they need a strong and viable workforce. Internment would definitely put a dent in morale, because no matter who you are, with 600 prison camps in the US you will likely know someone who is taken, and it would not be too hard to start striking back. Over 50% of American households has a gun(s). Secondly, our military is made up from...you guessed it: Americans. Will they stand by while their mothers, fathers, brothers, sisters, friends, etc are put into prison camp for a New World Order, or will they revolt? Third, there is an estimated 304,977,000 people in the USA. I don't know specifically how many people these camps can hold, but I can assure you 600 does not crest the 3 million mark. That leaves 301,977,000 to take up arms against the invasion. Now, just look how poorly we are doing in Iraq, a country of an estimated 29,267,000. Warfare usually starts by striking out against communication and business infrastructures, are they going to destroy internal resources that they will need to use to strengthen world position after such a catastrophe? More likely, the coffins are FEMA being prepared for mass casualties, an inevitability in any historical era. The camps, if I had to guess, is for a mass roundup of illegal aliens or internment of a specific cultural or racial subset that they would deem a threat in a situation of say...war with Iran. There is an estimated 500,000 Iranians in the US. Add other middle eastern races to the equation, since our government tends to be xenophobic in their regards, that number would rise. 

So, there is likely no war against the American people brewing, if there was, it would not last long, and the American people would prevail, quickly establishing a new government. Multiply the coffins and Prison camps by 100 and then it is time to worry. *This video is just another attempt by Jesus to scare you into submission to Christianity*. He may have used a voice changer, but we can see who has the most to gain from these scare tactics now. 

*Edit for spelling",0,1219929608,conspiracy,peridyn
c057dlf,6yaqb,c0574f1,these have nothing to do with FEMA.  the land there as well as the company that owns the land and burial vaults have nothing to do with FEMA.  someone one day saw some black boxes and put FEMA in the same sentence and everyone freaked out.  they have nothing to do with FEMA.,1,1219936049,conspiracy,bokin
c057e4i,6yg6f,6yg6f,it's possiblehttp://www.geocities.com/cpa_blacktown/20000318mediaoverb.htm,2,1219938023,conspiracy,pist
c057e97,6yg6f,6yg6f,It's obvious http://www.foxnews.com/,5,1219938493,conspiracy,Neuro420
c057gud,6ydam,6ydam,"The U.S. Supreme Court decided in the 1988 case California v. Greenwood, 486 U.S. 35 that anyone, including law enforcement agents and journalists, can access garbage that has been put out to be collected because it is considered public property.

http://en.wikipedia.org/wiki/California_v._Greenwood",1,1219946915,conspiracy,karma_chameleon
c057hgp,6yhwv,6yhwv,http://www.media-alliance.org/article.php?story=20040513171349558,2,1219948901,conspiracy,pist
c057hqj,6yaqb,c057bzy,"Your already in prison. Your freedoms continue to be restricted, your under increasing surveillance, your conditioned by fear mongering &amp; propaganda. Your a major event (false flag) away from becoming the next china. They won't imprison everyone, just ""terrorist"" trying to overthrow them. So good luck with the rebellion you speak of, every registered weapon would easily be confiscated to protect your freedoms.",2,1219949741,conspiracy,Neuro420
c057hql,6yhwv,6yhwv,i show them the back side of a US dollar bill.,4,1219949743,conspiracy,polymath22
c057hzq,6yhwv,6yhwv,"Here's what I'm fond of pointing out:

- Carol Quigley and his revelations in [Tragedy and Hope](http://www.dailykos.com/story/2008/7/27/65732/1557/694/557641)

- The [P2 Masonic Lodge](http://en.wikipedia.org/wiki/Propaganda_Due)

- [Operation Gladio](http://en.wikipedia.org/wiki/Operation_Gladio)

- The [business plot](http://en.wikipedia.org/wiki/Business_plot) ""against"" FDR

- [Union Banking Corporation](http://en.wikipedia.org/wiki/Union_Banking_Corporation)

- Rockefeller's lawyer, Allen Dulles, placed as Director of Central Intelligence. Then the [Rockefeller Commission](http://en.wikipedia.org/wiki/United_States_President%27s_Commission_on_CIA_activities_within_the_United_States), headed by Nelson Rockefeller, is tasked with investigating the same CIA that the John D. Rockefeller was instrumental in forming.

- The [Reece Committee Hearings](http://www.realityzone.com/hiddenagenda2.html)",7,1219950414,conspiracy,karmadillo
c057i0f,6yhwv,6yhwv,The United States Constitution.,2,1219950477,conspiracy,karma_chameleon
c057iwj,6yaqb,c057hqj,"No I'm not. I can go anywhere I want, whenever I want. Registered weapons confiscated? Good luck confiscating over a billion firearms. Who gets to put together that action plan? Taking a gun from anyone is something that can always go severely wrong. Under that ideology, why didn't the US just go take all the guns from the Iraqi's? We gave them to 'em, so we must know how many they have, right? That could have saved us trillions in war costs. The reason they did not, is because it is not possible. After the first 100 stories pop up about the government seizing guns, shit would start to hit the fan, and the line between American citizen and government would blur quickly. 

",2,1219953116,conspiracy,peridyn
c057k8x,6yhwv,6yhwv,"Nothing has ever worked in waking up any ""sheeple"" , in my experience.",4,1219957261,conspiracy,VoodooIdol
c057knp,6yg6f,6yg6f,"Our press was already controlled, for most intents and purposes, by the [early 1900's](http://findarticles.com/p/articles/mi_m0JZS/is_3_19/ai_n25062909).",5,1219958913,conspiracy,karmadillo
c057kpo,6yg6f,c057e97,"Bah, don't even need to anymore.  [The government hosts it's own propoganda BLOGS!](http://www.tsa.dhs.gov/blog)

Which reminds me, if I ever go on a plane, I'll have to pack in my case a few CDs...one labeled ""Detonator"", one labeled ""Child Porn Vol 3"", and one with random Arabic characters written on it.

Also, I should pack a carry-on with just Barry White albums, condoms, and coloring books.

Of course, I would never fly on a plane the way the TSA is now.  Fuck that, I'm not going to pay 200-500 dollars to have the pleasure of being treated like a criminal *to travel with in my own country's borders*",3,1219959169,conspiracy,JasonDJ
c057lgq,6yhwv,c057k8x,"I thought voodoo made people into zombies. I watched that serpent and the rainbow movie when I was a teenager, that was crazy.",2,1219962285,conspiracy,vague_blur
c057luz,6yhwv,6yhwv,"It's my experience that some people are mere actors, willed on by their surroudings, following the script to the very end. They never thought for themselevs to start with and therefore can't be saved.",7,1219963895,conspiracy,[deleted]
c057lv8,6yhwv,6yhwv,"[7 Conspiracies that Actually Happened](http://www.cracked.com/article_15974_7-insane-conspiracies-that-actually-happened.html)

[Bill Hicks](http://video.google.com/videoplay?docid=1366476727111157120&amp;ei=kCu3SLKqEYOI_QHf_szbDA&amp;q=bill+hicks)

[More Bill Hicks](http://video.google.com/videoplay?docid=1604695578417499645&amp;ei=kCu3SLKqEYOI_QHf_szbDA&amp;q=bill+hicks)

The second two aren't really minimalist facts, but I find humor always helps.
",2,1219963927,conspiracy,[deleted]
c057m2z,6yhwv,6yhwv,"A discussion about Pearl Harbor, Gulf of Tonkin, USS Liberty, Operation Northwoods/Mockingbird/Gladio is a good start.  Also, ""War is a Racket"" by 2-time Medal of Honor winning Marine Maj-Gen Smedley Butler for your ex-military grandpa or uncle who thinks you're full of crap since you never served.   ",2,1219964775,conspiracy,repoman
c057m6v,6yhwv,6yhwv,"Ask them if they've read Orwell and know doublespeak. Then speak to them in doublespeak.

War is peace. Slavery is freedom. Debt is wealth.",4,1219965237,conspiracy,[deleted]
c057m7p,6yhwv,c057hql,"Don't forget the spider on the front!

It's hidden, right in front of you and watching you.",2,1219965347,conspiracy,oldcrow
c057m97,6yhwv,6yhwv,"Personally, I like to go on the internet and yell at sheeple to wake up.  For example:

WAKE UP SHEEPLE!!!!!1!eleven!!",4,1219965562,conspiracy,EmpiresCrumble
c057mn1,6ydam,6ydam,Maybe I won't move there after all. ,1,1219967207,conspiracy,[deleted]
c057no1,6yhwv,6yhwv,Their shit's weak! Enough said. ,1,1219972068,conspiracy,shutupjoey
c057o6y,6yhwv,c057luz,"I call them robots.  It makes me happy though, because we can program them... via the Internet.  ",0,1219974542,conspiracy,theantirobot
c057q3x,6yhwv,6yhwv,"Sheeple like being sheeple. They put the blinders on and stick their fingers in their ears and yell ""la la la la la"" to block you out. They are living the dream. Nothing you say will convince them. Let them sleep.",3,1219984092,conspiracy,[deleted]
c057q4z,6yhwv,c057m7p,"That's not a spider, it is Molek the Owl",1,1219984232,conspiracy,[deleted]
c057qad,6yhwv,6yhwv,"I start by quoting this witty thing I found on the internet: ""Chritianity is the belief that a cosmic Jewish Zombie who was his own father can make you live forever if you symbolically eat his flesh and telepathically tell him you accept him as your master, so he can remove an evil force from your soul that is present in humanity because a rib-woman was convinced by a talking snake to eat from a magical tree.""  It rarely succeeds.",3,1219985052,conspiracy,phobophobia
c057qf3,6ykq3,6ykq3,"I like a good conspiracy just like anyone else. But, I think you're waaaaaay off base on this one. It just doesn't make any sense.",1,1219985814,conspiracy,[deleted]
c057s02,6yhwv,c057q3x,"I disagree, sir. Unless something can provide evidence that it is so - and survive repeated attempts at disproving it - then it is not so. Thus, whilst people on self.conspiracy are free to call people such as myself ""sheeple"" for questioning many conspiracy theories, it does not actually make us sheeple. My concept of reality is right until proven wrong, and I am not convinced that that has been achieved yet.",1,1219996274,conspiracy,[deleted]
c057ses,6yhwv,c057hql,"Oh, there's some crazy shit, man. There's a dude in the bushes. Has he got a gun? I dunno! RED TEAM GO, RED TEAM GO. ",1,1220000123,conspiracy,GoFlight
c057uij,6yhwv,c057s02,I reject your reality and substitute my own!,1,1220016782,conspiracy,rzm61
c057ulr,6yhwv,c057luz,Rewrite their script.,2,1220017217,conspiracy,OsakaWilson
c057uo5,6yhwv,6yhwv,"The video that showed the Pentagon with a hole in it, but no marks where the wings would have hit and no debris did it for me. That they won't release the video taken from surrounding cameras only further re-enforces it. 

That these people *would* do it is just beyond question.",5,1220017487,conspiracy,OsakaWilson
c057vro,6yhwv,c057q4z,"actually, i have heard both. that it is a spider, and that is an owl. im not sure which one is correct. it could be [either](http://tarasresources.net/dollar_spider.jpg
). maybe thats the point.",1,1220021837,conspiracy,polymath22
c057y0e,6ymie,6ymie,This looks like it is a really well-made documentary  - and a credible one at that.   I was expecting something more outlandish because it was posted on Prison Planet - the excerpts look like something Frontline could have produced.  I'm bookmarking it. ,1,1220028302,conspiracy,DudeAsInCool
c05851m,6yl54,6yl54,"Proof, please.",-2,1220050438,conspiracy,[deleted]
c0585zc,6yl54,c05851m,Everywhere. Just look. ,5,1220054604,conspiracy,-J-
c058a9i,6yqwm,6yqwm,"It's a bad title - it should read Denver Police Abuse Protesters At The DNC.  People have the right in this country to protest whatever they want to, and the police clearly overstepped their bounds in Denver.",2,1220079871,conspiracy,DudeAsInCool
c058b30,6yl54,c0585zc,I remain unconvinced. There are holes in the alternative theories being presented by the 'truth' movement. ,1,1220087789,conspiracy,[deleted]
c058buq,6yqwm,c058abh,"I think it's more that AJ, most likely unknowingly, is being used by the elite.",2,1220097078,conspiracy,[deleted]
c058dsl,6yaqb,c0571jc,"No it isn't.
The US gov learned something from Katrina: You have to have coffins, otherwise floods get a lot more problematic.",1,1220111766,conspiracy,behanger
