id,post_id,parent_id,body,score,created_utc,subreddit,author
c039ge1,69he6,69he6,whatever,1,1203820293,conspiracy,esparza74
c03ip7o,6d3nu,6d3nu,"the Elite's M.O. - Concentrate wealth while trickling down just enough to quell a revolution. 

Ensure corporate-sponsored artificial scarcity continues as long as possible. 

Derive profit via war/eugenics and wasteful designs.

Divide and conquer and conquer and divide.

Maintain democracy and the 'free press' as illusions.

Make cents, while rarely making sense.",1,1206305202,conspiracy,all_ways_thinkin
c03lpah,6e85q,6e85q,The source page is Rense.,1,1207083639,conspiracy,[deleted]
c03mds6,6efk5,6efk5,Didn't they try this with postal workers?,2,1207252599,conspiracy,Slipgrid
c03o1e4,6f33g,6f33g,Someone tell me this is just scare-tactics and propaganda...  please?,4,1207711935,conspiracy,El_Guapo
c03o1vn,6f33g,c03o1e4,"I've read about the disease before, and it is real.  This is the first that I've heard of a cause, and it is scary.  Makes my skin craw just thinking about it. ",1,1207715364,conspiracy,Slipgrid
c03o284,6f33g,c03o1vn,"I propse a submission of parent comment as it's own story with the headline ""Thinking about Morgellon's Disease linked to the nightmare condition called Morgellon's Disease""",3,1207717859,conspiracy,Enoxice
c03o3f4,6f33g,6f33g,"This has been discounted as many times as it's been ""proven"".  No medical professional has come forward and said it's real and the name was given by lay folk.

There is currently a CDC investigation underway, but that's only to figure out what the hell it really is.  They're nowhere near determining the cause just yet.

http://en.wikipedia.org/wiki/Morgellons
",1,1207730189,conspiracy,codepoet
c03o43e,6f33g,6f33g,"It is just scare-tactics and propaganda. The disease has been around longer than genetically modified foods.

Yes, the disease is absolutely real.

Morgellon's Disease sort of reminds me of the series of books on which the movie tremors was (quite loosely) based. The books were much, much better than the movie. There was a condition where a person would grow pink, worm-like threads from their flesh if they'd been contaminated with a certain substance associated with the invaders. Nasty shit. Very scary. Like Morgellon's.",1,1207740892,conspiracy,ReligionOfPeace
c03olqw,6f33g,6f33g,Rubbish. Absolute rubbish.,1,1207855419,conspiracy,[deleted]
c03q49g,6fuva,6fuva,...you didn't know that?,1,1208271812,conspiracy,leavesoflorien
c03s79e,6glk7,6glk7,"I seriously think that 9/11 was caused by a group of pissed off Muslim terrorists, and nobody else.",-4,1208819824,conspiracy,[deleted]
c03sf68,6glk7,c03s79e,Stay the course.,4,1208880346,conspiracy,Vreep-eep
c03tj1o,6h2f8,6h2f8,Wow.  All that security for Arnie? Pretty sure he can hold his own.,1,1209120910,conspiracy,[deleted]
c03vmja,6hpup,6hpup,Oh shit todays is May 1st! The FEMO drills are starting today!,1,1209652197,conspiracy,[deleted]
c03wi5u,6i2tm,6i2tm,"and I pay for it,sigh. Maybe time for the switch to Linux, or back to OS/2, that was and still is hack-proof.
Katie",2,1209867120,conspiracy,tsfrankie
c03xwsv,6ik2e,6ik2e,"Too much evidence that leaves gaping holes in the original story. We obviously don't have to list them all here...they are all over the net...flight 11, wtc 7...etc etc.  We need REAL answers.  Look at what 9/11 launched...a middle east war that will last decades.  
Who has enjoyed record profits since 9/11? Ah we can go on and on...so what goes on in the mindset of an 'original story-er'?",5,1210201736,conspiracy,[deleted]
c03xxiz,6ik2e,c03xx04,"Thx. Upmod right back to you. OK honest discussion...I really don't think that a thousand gov't employees were given a 'memo' about the attack or anything. It wouldn't really take that many people to get this done. I think one of the following happened..or a combination of them. 

1. The original story is true. Once we were attacked -  evil people made it look worse to coincide with agendas.  Lets attack the pentagon and send out anthrax letters afterwards...signed and sealed with Al Queda boogy man stuff. Ha ha. 
2. The original story is true and the terrorists were HELPED by some sort of internal group to get the job done.  Thus planting bombs in buildings...etc.

I can continue this list with all the other theories...but you can see I don't think that the original story holds any water my friend.   Can you explain flight 11 and the lack of a plane at the crash site? Have you seen the WTC 7 footage?  Where did the antrax come from and who sent it?  Why have we not seen the plane attack the pentagon?  They released like 4 frames from the orginal video a while ago?  Why not the whole video?  What are they hiding? These are the questions I need answers to and untill somebody does, I think we will always be having this conversation.",2,1210205841,conspiracy,[deleted]
c03xxqo,6ik2e,c03xxn5,"Right...and lets not forget those fake videos of Bin Laden that were produced.
Even if the security was lax as you mention...that is still 'inside job-ish' right?  ",5,1210207001,conspiracy,[deleted]
c03xyuv,6ik2e,c03xye3,I agree.  The US people have been wronged as well as Iraqi civilians. Lets just hope Iran doesn't get the next nod.,5,1210214024,conspiracy,[deleted]
c03y2n0,6ik2e,c03xx04,"*Do you honestly think that out of the thousands of government employees and media contacts required to keep up the charade, not one would come forward?*

This is a common objection.  The problem with this objection is that operations of this sort are usually highly compartmentalized, with only a handful of ""prime movers"" at the center who have any idea what is actually happening.  

Douglas Hermans explains this quite well in his short essay, [""How 50 Men May Have Engineered 911""](http://www.indybay.org/newsitems/2006/09/13/18309235.php)

(BTW, let me just thank you for starting this discussion.  It's nice to be able to rationally discuss the inconsistencies of 9/11 without immediately being derided as a ""moonbat"" or ""tinfoil-hatter"".  I look forward to a thoughtful, mature, and enjoyable discussion.)",8,1210249498,conspiracy,TripMaster_Monkey
c03y35w,6ik2e,c03xx04,"&gt;Do you honestly think that out of the thousands of government employees and media contacts required to keep up the charade

Manhattan Project.",6,1210253111,conspiracy,[deleted]
c03y7a6,6ik2e,c03xx04,"Why do so many people need to be involved?  Wouldn't it really just require a few people with knowledge?  Why would the media contacts necessarily be ""in the know""?  Why would anyone but the handful of people involved in the cover up need to be ""in the know""?",3,1210271779,conspiracy,VoodooIdol
c03y7bd,6ik2e,c03xyuv,Let's not forget the Afghanis.,1,1210271825,conspiracy,VoodooIdol
c03y7st,6ik2e,c03xx04,"&gt;Do you honestly think that out of the thousands of government employees and media contacts required to keep up the charade, not one would come forward?

It's called compartmentalization.  And, people die in odd ways all the time.  It's said the DC Madam had info from Military people she talked with.  She died.  There was that guy that may've been a CIA agent in TX; he got blasted.

&gt;And that the 'insiders' would be able to control the news coverage not just of US stations, but the BBC, etc?

Everyone that's important in the media is a CIA agent.  You don't have to *control* people; people know what they are supposed to do so they won't get fired.

&gt;why attack the Pentagon itself when the WTC would do?

You have to broaden the threat to make it seem more like a true act of war.  It's interest me that Sept. 11, 2001 was sixty years to the day after the ground breaking on the Pentagon.

&gt;And why blow up WTC 7, a building that isn't a landmark and is in the path of debris anyway?

&gt;It was a federal building.  Same reason they blew up the federal building in OK City; it's a quick way to get rid of documents and evidence.  The Enron Documents were their.",3,1210273871,conspiracy,Slipgrid
c03y7yh,6ik2e,c03xxn5,"He mentions the Anthrax letters which is really interesting.  We all know the Anthrax came from a US military facility and we know reports are continuing to get Anthrax-type threats.  Look at the known targets of the Anthrax letters.  Don't you think it's interesting that no tabloid has ever mentioned 9/11 Truth?  I think it's odd.

Also, along the same line, a few nights ago I was watching some of the original footage from archive.org.  I was watching the ABC broadcast, near the end of the first hour and the beginning of the second hour.  Anyway, they have footage of the second plane hitting the building and they keep showing it over and over.  It's zoomed out really far, like all the other images we've seen.  Then, they show about two seconds of footage that is zoomed in really tightly, but it's not of the plane, but the explosion in the building.  They have to have a picture of the plane zoomed in the same way; that camera was following it.  There are stories of showings of this footage.  Anyway, how come, in NYC, there is not a closeup image of that plane?  Why is there not an image close enough to ID it?  Why do the pictures that do ID it show a pod underneath it?",1,1210274459,conspiracy,Slipgrid
c03ya75,6ik2e,c03y62x,"A couple of other things - 

(1) The guys that flew the planes were apparently only trained to fly Cessnas - and they weren't too good at that - yet they managed to hit precise targets hundreds of miles from their takeover moment - even performing a complex manoeuvre to hit the far side of the pentagon.

(2) All pilots are apparently issued with some code they can easily punch into their com panel if they are being hijacked.  For some Bizarre reason, of the 4 hijacked pilots - none managed to complete this apparently simple task.

(3) The black boxes, designed to survive anything, were never found - yet Mohammed Atta's passport fluttered, undamaged, to the ground.

[Edit - clarity]",5,1210284566,conspiracy,StoneMe
c03yc22,6ik2e,c03xxn5,"&gt;Plus, why send the letters to Democrats?

To scare the shit out of them - so they would vote for the patriot act without even reading it - which is just what they did.",2,1210295125,conspiracy,StoneMe
c03yc34,6ik2e,6ik2e,"There are precedents -

http://en.wikipedia.org/wiki/Operation_Northwoods",2,1210295339,conspiracy,StoneMe
c03zlm0,6j3pk,6j3pk,In what way is teaching the constitution terrorism? Unless... wait. Does that make the US a terrorist state?,1,1210631104,conspiracy,[deleted]
c03zm6d,6j3pk,6j3pk,I think I need some citations instead of this word of mouth stuff before I can get chuffed.,0,1210633875,conspiracy,VoodooIdol
c04027b,6j3pk,6j3pk,"Constitutional Law Student threatened for preaching Creationism.

*And I think to myself...   what a wonderful world?*

(Aw, shit...  fucking infowars again)",1,1210727412,conspiracy,El_Guapo
c0406ey,6jbph,6jbph,Some correspondence with [Jake Adelstein](http://www.washingtonpost.com/wp-dyn/content/article/2008/05/09/AR2008050902544_pf.html) on this [here](http://cryptogon.com/?p=2559).,0,1210755718,conspiracy,Escafane
c04070m,6jbph,6jbph,"Assuming that the whole Illuminati conspiracy is true, and I personally doubt it is, then the illuminati getting into a fight with a secret cabal of Chinese assasins sounds AWESOME.

Also, death by stroke pill? That's a tall order to swallow. ",2,1210762395,conspiracy,[deleted]
c042puh,6k4lf,6k4lf,"BravoLima, I'm looking at you.",-1,1211309021,conspiracy,redrobot5050
c043sxi,6kdbs,6kdbs,Apparently Prescott Bush also had some Nazi cravats.,1,1211533672,conspiracy,crazybones
c043uf9,6kiar,6kiar,Some thorough and hilarious research there.,2,1211549792,conspiracy,[deleted]
c043v62,6kiar,6kiar,Funny stuff! Unless he was being serious...,1,1211553588,conspiracy,mattmanp
c04410c,6kdbs,6kdbs,Why is this in the conspiracy section?,1,1211579732,conspiracy,Slipgrid
c04433w,6kiar,6kiar,That's certainly an amazing use of ... something other than smarts.,0,1211593435,conspiracy,codepoet
c044i7h,6kl3v,6kl3v,Don't be ashamed because you're slow. ,2,1211720310,conspiracy,michael333
c044sjc,6ks6x,6ks6x,"We are not nuts.  Most of the people who question the official version that we have been told about the events of 9/11 have read quite a bit, including the reports of educated physicists, disillusioned US army personnel, eye-witnesses of the events as they occurred, air traffic controllers, and many other people who are intelligent and/or well-educated.  As far as photo evidence of plane parts, all that is easy enough to fake.  And, to tell you the truth, the pictures that I really hate are the ones of people jumping out of the windows of the tower after what I believe was deliberate sabotage(EDIT: mass murder) by traitors in our own government, and other involved parties.",4,1211798484,conspiracy,[deleted]
c044t8n,6ks6x,6ks6x,"I'm just going to play devil's advocate with this list.  

I don't think everything this person has brought up is necessarily incorrect, just that there is always room for some leeway between the two sides.

1) Not all ""conspiracy theorists"" argue that no plane hit the pentagon.  Many people argue that it was a smaller or unmanned plane, and may have fired a missile directly into the building.  This would account for the wreckage and the damage.

If you study the pentagon recovery closely, you will see small fragments of a plane strewn about the wreckage.  Now, for me I'm most concerned with how we can only recover small pieces of an 80 ton airliner that we're told was consumed in fire, and told to simultaneously believe that although they didn't find much wreckage that they were able to completely identify all of the bodies.

Who is right?  Well there is no way to know since the government wants to hide all of the evidence, so they deserve to get people asking as many questions as possible.

For example, we all know there are multiple videos like the traffic cameras that would clearly show the plane hitting the pentagon, but instead of releasing those videos, we get 5 frames of a security camera that don't clearly show anything.

A photo of a landing gear does not prove to me that flight 77 was the plane that hit the pentagon (especially since the damage to the building is inconsistent with a plane of that size hitting it (intact windows on the second floor, no engine holes, etc.)) , and we should not be willing to take such evidence as to be proof of that, while they hide evidence from us that would actually prove this one way or the other.  

2) Not arguing this, I believe debris from the tower did reach WTC7.  I don't believe this was sufficient to collapse building 7 8 hours later.

3) Same as #2. Also, worth noting is that wtc6 was 8 stories, was heavily damaged and did collapse in the center due to debris, however all of the walls were still standing.  To this day there is no **official** cause for WTC7's collapse, so it's very hard to argue against the government's claims when they haven't even given us a reason the building fell.

4+5) Not arguing these, fires definitely spread to WTC7 as evidenced by firefighter transcripts.  How the fire caused the building to collapse is the important part, and the answers are still forthcoming.

6) I see a plume of smoke in a photo, and I do believe that this photo is real.  However, this photo does nothing to explain how the debris for the plane got spread over at 8 mile radius with primary and secondary debris fields miles apart.  

7) again, very small pieces of plane debris.  where the heck is the plane?  again, i'm not arguing that the plane was not flight 93, it may have been.  but these photos do little to answer all of the questions out there.

""There were pieces of fuselage and clothing all over the area, burning, said Peterson. He said he didn't see any debris longer than a couple of feet long.""

http://www.post-gazette.com/headlines/20010911somerset0911p4.asp

couple of feet?

""following the discoveries of more debris, including what appeared to be human remains, miles from the point of impact at a reclaimed coal mine.""

http://post-gazette.com/headlines/20010913somersetp3.asp

miles away?

8) I've stared at this photo, and I can't see what the author is pointing out yet.  

9) Yes the workers in the wreckage did cut the steel beams, does this mean that they were the only ones responsible for doing this... hard to say.  I would love it if we could find all of these photos with intact EXIF data so that we could see the exact dates that they were all taken.  

Additionally workers at ground zero cutting steel beams do not account for the molten steel that was found at the bases of 1,2, and 7 weeks after the event, the pulverized concrete, and the molten concrete

http://www.whatreallyhappened.com/IMAGES/9-11guns/

10) i think he's arguing with himself on this one because i've been looking at this for awhile now and i have yet to hear anyone suggest that any debris or even the towers themselves fell faster than freefall. (not that there is anything stopping someone from saying something like this)  also, the towers fell at ""nearly"" freefall speed which is to say that the lower floors gave almost no resistance.  I just can't believe that.

anyway, i agree with the author that arguing all of this is an exercise in futility.  

my opinion is that as long as the government withholds information from it's people that we should have every right to question them.

while these photos may disprove some of the more wilder ideas about what might have happened, it does little to answer a lot of the real questions that are still out there.",4,1211807322,conspiracy,[deleted]
c044tth,6ks6x,6ks6x,Fancy not believing the government - These people must be nuts!,5,1211812580,conspiracy,StoneMe
c044u1n,6ks6x,6ks6x,That's some nice use of strawmen there. I'm surprised he managed to avoid bringing up the pod theory as well.,3,1211814440,conspiracy,Vreep-eep
c044ywz,6ik2e,6ik2e,"1. Secret organizations are a political fact. Therefore conspiracies are everywhere.
2. Governments lie. Especially the most powerful.
3. The US government has done many bad things in the past, and only some of them have been exposed.
4. 9/11 allowed the passage of many laws that were prepared well in advance. If it wasn't planned by those that want the war on terror, then it was a coincidence of epic proportions.",1,1211842520,conspiracy,astitious
c0457gp,6kl3v,6kl3v,experts in what? muffins?,-2,1211901213,conspiracy,[deleted]
c045e3o,6kxn3,6kxn3,"NOBODY IS ALLERGIC TO WI-FI

THIS MAKES ME SO MAD I CAN'T TYPE RATIONALLY!

MUST-CRUSH-NEWSPAPER!",2,1211931073,conspiracy,[deleted]
c045k0t,6kxn3,c045je5,"AH WHAT HAVE I DONE

THERE IS SHARP SILICON IN MY HAND

I AM NOT GOOD WITH COM-PEW-TOR",1,1211972513,conspiracy,[deleted]
c04631k,6l9ve,6l9ve,"*What can we do to change this?*

* Buy the DVD.
* Invite everyone you know over to watch it. (Don't just invite fellow Truthers...there's no point in echo chambers.  The idea is to *spread* the word.)

* Encourage everyone to purchase their own copies and repeat the steps above.  I don't know how Paul Cross feels about people pirating his movie, but at a paltry $20, it's worth the purchase, and I'm sure Paul can use any income he can get, having been so thoroughly blackballed by the corrupt corporate establishment.",6,1212082807,conspiracy,TripMaster_Monkey
c0463g9,6l9ve,c04631k,Yup.,3,1212084222,conspiracy,dur23
c0463lp,6l9ve,6l9ve,"Ok, I just purchased it. Cheaper on Amazon.",3,1212084835,conspiracy,windeva
c0468ex,6l9ve,6l9ve,"&gt;""There was no passenger jet wreckage; the lawn wasn't scorched; lamp posts, fences and construction materials in the path of the jet were untouched.""

This is patently untrue.  I was there myself.  Lamp posts and fences near the actual impact (note I'm not saying *what* impacted the building) were most defintely either down or seriously fucked up.",0,1212102316,conspiracy,VoodooIdol
c046a0i,6l9ve,c0463lp,Groovy. **^_^**,2,1212109824,conspiracy,TripMaster_Monkey
c046d2a,6l9ve,6l9ve,Can I build a business catering to 9/11 truthers too?,-1,1212125157,conspiracy,[deleted]
c046fjm,6l9ve,6l9ve,"Share it with Bit Torrent ?
",1,1212148954,conspiracy,zzazz
c046p0u,6lfwg,6lfwg,Damn. I was hoping to be RickRolled.,0,1212194621,conspiracy,AoP
c048yfp,6m6f7,6m6f7,"So soon after Obama takes the nomination? Shit has hit the fan for ol Bilderberg! How many times do you think the phrase "" I want that man dead"" will come up in their meeting?",2,1212682124,conspiracy,[deleted]
c048znv,6m6f7,c048yfp,"naw dude.

obama was picked and is the annointed one.

**obama is just PR** to make America look good to the rest of the world's proles, while keeping the same foreign policies around the world.


Proof:
http://www.reddit.com/info/6j27c/comments/
http://www.reddit.com/info/6lww3/comments/",7,1212686739,conspiracy,AmericanGoyBlog
c049032,6m6f7,6m6f7,"I know how most of reddit feels about anything Alex Jones has to say. But this much is sadly true.
&gt;If 125 film stars booked out a hotel, arrived in dark-tinted limosuines and met in secret do you think the corporate media would be interested in finding out what they were there to discuss?

&gt;Yet 125 top CEO's, hugely influential philanthropists, heads of state, NATO officials, academic leaders, banking kingpins, and European royalty - the very people that shape the destiny of the world - can get together for three days without a single U.S. corporate media outlet reporting on it. ",10,1212688158,conspiracy,mountainman
c0490p6,6m6f7,c048znv,"You know, I am inclined to believe you. Isn't it odd though, a black man versus a white woman in the same year running agianst each other for the nomination... litterally splitting the party? And the one who supports and assist McCain more than anyone else ends up making a mockery of the entire event causing dems to look at the republicans?
Hillary and McCain have proven themselves to be in bed with each other for a while now. I am beginning to suspect that having a black man and a woman duking it out has less to do with world view (as if they care) and more to do with getting/tricking dems to vote republican. Cheating on ballots is old hat. If you want to upset the ballot, split the oppositions party in half. 
",3,1212690537,conspiracy,[deleted]
c04921p,6m6f7,6m6f7,"""Nothing to see here""

http://www.youtube.com/watch?v=rSjK2Oqrgic
",1,1212695963,conspiracy,fuqdub
c04933l,6m6f7,6m6f7,I wonder what they are talking about this year?,1,1212700127,conspiracy,anniepema
c0494ez,6m6f7,c0490p6,"You are close, but still you refuse to see it.

Both the democrats and the republicans work for the same people, the same $$$ donors, the same lobbying interests.

There is VERY little difference between the 2.

My favorite example is AIPAC, to which Obama, Hillary and McCain, and Pelosi, and the republican minority whip (whoever the fuck it is now) are all invited to proclaim their undying love to Israel and their desire to bomb Iran.

But all the other lobbies work the same way - they pay both parties to take care of business.

Get out of your dems vs. repubs mindset - that time is past, and it does not exist.",5,1212705994,conspiracy,AmericanGoyBlog
c0494p6,6m6f7,6m6f7,"This is a terrible end-around to the democratic process.  Say what you will about Jones, but he has the nuts to confront this globalist agenda.

I guess I'm not all that surprised that something this important isn't even news on reddit much less the MSM.",4,1212707479,conspiracy,veritaze
c0494vq,6m6f7,c048znv,"Yah, Obama is CFR-approved.  They just let him and Clinton fight it out, basically.  May the best tool win.",3,1212708692,conspiracy,veritaze
c0495yh,6m6f7,c0494vq,"Click the links (not my articles).

""Bill Kristol At AIPAC: Obama And McCain ""Don't Actually Differ"" On Iran""
http://www.huffingtonpost.com/2008/06/02/bill-kristol-at-aipac-oba_n_104799.html

""Speaking to Former AIPAC Lobbyist Wolf Blitzer, Obama Says ""We Will Stand With Israel for 600 Years""""
http://blogs.independent.co.uk/the_campaign_trailers/2008/05/obama-on-foreig.html


He is AIPAC approved also.",1,1212716455,conspiracy,AmericanGoyBlog
c049a8q,6m6f7,6m6f7,"I've never been a believer about the New World Order/Illuminati conspiracy, but Bilderberg? There's definately something going on there. It's an evil group. They do evil things. They agree on doing evil things to the planet and its peoples behind closed doors. It's fucking terrible.",2,1212752465,conspiracy,[deleted]
c049a9g,6m6f7,c04933l,"Same thing they talk about every year, Pinky.

HOW TO TAKE OVER THE WORLD (And turn us all into mindless slaves)",1,1212752681,conspiracy,[deleted]
c049aox,6m6f7,6m6f7,Isn't it also interesting the Obama and Clinton met in secret in the same area where the conference is going on...?,2,1212756136,conspiracy,WhoKilledTeddyBear
c049dau,6matr,6matr,"Havn't watched the video yet, but I had my suspicions when the earthquake happened that it may have been the U.S. using HAARP.",0,1212767705,conspiracy,Phazon
